{
  "spec_version": "0.2",
  "source": {
    "project": "MISP",
    "repository": "MISP/MISP",
    "commit": "843b67445060e4da71ebf75cc4a9646c301f749d",
    "file": "app/Lib/Tools/AttributeValidationTool.php"
  },
  "defaults": {
    "normalize": [
      {
        "op": "replace_non_bmp",
        "replacement": "?"
      }
    ]
  },
  "definitions": {
    "hashes": {
      "authentihash": {
        "encoding": "hex",
        "length": 64
      },
      "md5": {
        "encoding": "hex",
        "length": 32
      },
      "imphash": {
        "encoding": "hex",
        "length": 32
      },
      "telfhash": {
        "encoding": "hex",
        "length": [
          70,
          72
        ]
      },
      "sha1": {
        "encoding": "hex",
        "length": 40
      },
      "git-commit-id": {
        "encoding": "hex",
        "length": 40
      },
      "x509-fingerprint-md5": {
        "encoding": "hex",
        "length": 32
      },
      "x509-fingerprint-sha1": {
        "encoding": "hex",
        "length": 40
      },
      "x509-fingerprint-sha256": {
        "encoding": "hex",
        "length": 64
      },
      "ja3-fingerprint-md5": {
        "encoding": "hex",
        "length": 32
      },
      "jarm-fingerprint": {
        "encoding": "hex",
        "length": 62
      },
      "hassh-md5": {
        "encoding": "hex",
        "length": 32
      },
      "hasshserver-md5": {
        "encoding": "hex",
        "length": 32
      },
      "pehash": {
        "encoding": "hex",
        "length": 40
      },
      "sha224": {
        "encoding": "hex",
        "length": 56
      },
      "sha256": {
        "encoding": "hex",
        "length": 64
      },
      "sha384": {
        "encoding": "hex",
        "length": 96
      },
      "sha512": {
        "encoding": "hex",
        "length": 128
      },
      "sha512/224": {
        "encoding": "hex",
        "length": 56
      },
      "sha512/256": {
        "encoding": "hex",
        "length": 64
      },
      "sha3-224": {
        "encoding": "hex",
        "length": 56
      },
      "sha3-256": {
        "encoding": "hex",
        "length": 64
      },
      "sha3-384": {
        "encoding": "hex",
        "length": 96
      },
      "sha3-512": {
        "encoding": "hex",
        "length": 128
      },
      "dom-hash": {
        "encoding": "hex",
        "length": 32
      }
    }
  },
  "types": {
    "md5": {
      "normalize": [
        {
          "op": "lowercase"
        }
      ],
      "validate": {
        "op": "hash",
        "algorithm": "md5"
      },
      "error": {
        "code": "invalid_hash",
        "message": "Checksum has an invalid length or format."
      }
    },
    "sha1": {
      "normalize": [
        {
          "op": "lowercase"
        }
      ],
      "validate": {
        "op": "hash",
        "algorithm": "sha1"
      },
      "error": {
        "code": "invalid_hash",
        "message": "Checksum has an invalid length or format."
      }
    },
    "sha256": {
      "normalize": [
        {
          "op": "lowercase"
        }
      ],
      "validate": {
        "op": "hash",
        "algorithm": "sha256"
      },
      "error": {
        "code": "invalid_hash",
        "message": "Checksum has an invalid length or format."
      }
    },
    "port": {
      "validate": {
        "op": "integer",
        "min": 1,
        "max": 65535
      },
      "error": {
        "code": "invalid_port",
        "message": "Port numbers have to be integers between 1 and 65535."
      }
    },
    "weakness": {
      "normalize": [
        {
          "op": "replace",
          "old": "–",
          "new": "-"
        },
        {
          "op": "uppercase"
        }
      ],
      "validate": {
        "op": "regex",
        "pattern": "^CWE-[0-9]+$"
      },
      "error": {
        "code": "invalid_weakness",
        "message": "Invalid format. Expected: CWE-x..."
      }
    },
    "uuid": {
      "normalize": [
        {
          "op": "lowercase"
        }
      ],
      "validate": {
        "op": "regex",
        "pattern": "^[0-9a-fA-F]{8}(-[0-9a-fA-F]{4}){3}-[0-9a-fA-F]{12}$"
      },
      "error": {
        "code": "invalid_uuid",
        "message": "Invalid UUID format."
      }
    },
    "onion-address": {
      "normalize": [
        {
          "op": "lowercase"
        }
      ],
      "validate": {
        "op": "regex",
        "pattern": "^([a-z2-7]{16}|[a-z2-7]{56})\\.onion$"
      },
      "error": {
        "code": "invalid_onion_address",
        "message": "Onion address has an invalid format."
      }
    },
    "hex": {
      "normalize": [
        {
          "op": "uppercase"
        }
      ],
      "validate": {
        "op": "hex"
      },
      "error": {
        "code": "invalid_hex",
        "message": "Value must contain only hexadecimal characters."
      }
    },
    "integer": {
      "validate": {
        "op": "integer"
      },
      "error": {
        "code": "invalid_integer",
        "message": "The value has to be an integer value."
      }
    },
    "boolean": {
      "validate": {
        "op": "boolean"
      },
      "error": {
        "code": "invalid_boolean",
        "message": "The value has to be boolean."
      },
      "normalize": [
        {
          "op": "trim"
        },
        {
          "op": "lowercase"
        },
        {
          "op": "normalize_boolean"
        }
      ]
    },
    "ip-src": {
      "normalize": [
        {
          "op": "normalize_ip"
        }
      ],
      "validate": {
        "op": "ip",
        "allow_cidr": true
      },
      "error": {
        "code": "invalid_ip",
        "message": "IP address has an invalid format."
      }
    },
    "filename|md5": {
      "validate": {
        "op": "composite",
        "separator": "|",
        "fields": [
          {
            "name": "filename",
            "validate": {
              "op": "string",
              "min_length": 1
            }
          },
          {
            "name": "hash",
            "normalize": [
              {
                "op": "lowercase"
              }
            ],
            "validate": {
              "op": "hash",
              "algorithm": "md5"
            }
          }
        ]
      },
      "error": {
        "code": "invalid_filename_hash",
        "message": "Invalid filename|md5 value."
      }
    },
    "domain": {
      "normalize": [
        {
          "op": "lowercase"
        },
        {
          "op": "trim_chars",
          "characters": "."
        }
      ],
      "validate": {
        "op": "regex",
        "pattern": "^[A-Z0-9.\\-_]+\\.[A-Z0-9\\-]{2,}$",
        "case_insensitive": true
      },
      "error": {
        "code": "invalid_domain",
        "message": "Domain has an invalid format."
      }
    },
    "hostname": {
      "normalize": [
        {
          "op": "lowercase"
        }
      ],
      "validate": {
        "op": "regex",
        "pattern": "^[A-Z0-9.\\-_]+\\.[A-Z0-9\\-]{2,}$",
        "case_insensitive": true
      },
      "error": {
        "code": "invalid_hostname",
        "message": "Hostname has an invalid format."
      }
    },
    "url": {
      "validate": {
        "op": "string",
        "forbidden": [
          "\n"
        ]
      },
      "error": {
        "code": "newline_not_allowed",
        "message": "Value must not contain new line character."
      }
    },
    "email": {
      "normalize": [
        {
          "op": "lowercase"
        }
      ],
      "validate": {
        "op": "regex",
        "pattern": "^.[^\\s]*@.*\\..*$",
        "case_insensitive": true
      },
      "error": {
        "code": "invalid_email",
        "message": "Email address has an invalid format."
      }
    },
    "email-src": {
      "normalize": [
        {
          "op": "lowercase"
        }
      ],
      "validate": {
        "op": "regex",
        "pattern": "^.[^\\s]*@.*\\..*$",
        "case_insensitive": true
      },
      "error": {
        "code": "invalid_email",
        "message": "Email address has an invalid format."
      }
    },
    "email-dst": {
      "normalize": [
        {
          "op": "lowercase"
        }
      ],
      "validate": {
        "op": "regex",
        "pattern": "^.[^\\s]*@.*\\..*$",
        "case_insensitive": true
      },
      "error": {
        "code": "invalid_email",
        "message": "Email address has an invalid format."
      }
    },
    "target-email": {
      "normalize": [
        {
          "op": "lowercase"
        }
      ],
      "validate": {
        "op": "regex",
        "pattern": "^.[^\\s]*@.*\\..*$",
        "case_insensitive": true
      },
      "error": {
        "code": "invalid_email",
        "message": "Email address has an invalid format."
      }
    },
    "whois-registrant-email": {
      "normalize": [
        {
          "op": "lowercase"
        }
      ],
      "validate": {
        "op": "regex",
        "pattern": "^.[^\\s]*@.*\\..*$",
        "case_insensitive": true
      },
      "error": {
        "code": "invalid_email",
        "message": "Email address has an invalid format."
      }
    },
    "datetime": {
      "validate": {
        "op": "datetime"
      },
      "error": {
        "code": "invalid_datetime",
        "message": "Datetime has to be in the ISO 8601 format."
      },
      "normalize": [
        {
          "op": "normalize_datetime"
        }
      ]
    },
    "ssdeep": {
      "validate": {
        "op": "regex",
        "pattern": "^[0-9]+:[0-9a-zA-Z/+]*:[0-9a-zA-Z/+]*$"
      },
      "error": {
        "code": "invalid_ssdeep",
        "message": "Invalid SSDeep hash. The format has to be blocksize:hash:hash."
      }
    },
    "tlsh": {
      "normalize": [
        {
          "op": "lowercase"
        }
      ],
      "validate": {
        "op": "regex",
        "pattern": "^t?[0-9a-f]{36,}$"
      },
      "error": {